{
  "schema_version": "local-windows-task-record/v1",
  "instance_id": "aaaaaaaaaaaaaaaaaaaaaaaaaaaaaaaaaaaaaaaaaaaaaaaaaaaaaaaaaaaaaaaa",
  "state_directory_id": "bbbbbbbbbbbbbbbbbbbbbbbbbbbbbbbbbbbbbbbbbbbbbbbbbbbbbbbbbbbbbbbb",
  "task_name": "\\SIQ-Agent-Security-aaaaaaaaaaaaaaaaaaaaaaaaaaaaaaaaaaaaaaaaaaaaaaaaaaaaaaaaaaaaaaaa",
  "xml_sha256": "8ace57152bda2d48244c3b38746a73f5409d4d780af6c3ddd4e8a749ba89c749",
  "user_sid": "S-1-5-21-100-200-300-1001",
  "signature": "c65fefe10c58e5a076108254da87acbe24c543b3eaa43eaa699dd01421fdd67761a3f7041f6405eb507a8589aff879a9dafe273f162b683b4c92ffd278e3270b"
}
